user,Review,SENTIMEN
Nichelle23,Payah kali loginnya Kenapa ni?,positif
dinaelvinna,Payah. Kok gak bisa daftar akun di shope?,positif
VaniaAdristi_,Dapat email habis penyelesaian pesanan akun anda di hapus ...apa salah saya ya... padahal sering belanja ya lancar ...jadi kecewa sama shopee yang tiba tiba menonaktifkan akun shopee saya,positif
rossitarwr,"Udh gk jelas aplikasi ini, dlu ok skarenag gara2 ada shopeepaylater orang lain yang belum bayar malah saya yang akunnya di batasi pdhal beda akun shopee, kecewa sih. Akun di batasi gak bisa belanja lah otomatis buat apalagi punya akun ini kalo gaada gunanya, makin sini shopee udh kebanyakan yang pakai bukannya di perbaiki atau di nyaman2 malah bikin gk nyaman banget ribet lagi, gk bisa belanja lagi akun di batasi.. Minta di uninstal aplikasi ini secara tidak langsung.",positif
Nafisa22,"Sekarang mau order malah sulit, gimana sihha padahal semua persyaratan sudah benar, tapi tetap aja ngak bisa??????",positif
bungabcd_,"Kecewa... Saya belanja pas waktu HARBOLNAS, tiba² pesanan dibatalkan oleh penjual,,kok pihak Shopee gak ada respon ya...sudah gt duitnya dikrmbalikan kena biaya ADM pula... Jadi saya sebagai konsumen sudah dirugikan.....",positif
ananastase,"Gratis Ongkir sekarang dikurangin, aplikasi sebelah udh banyak tuh gratis ongkir pakai metode pembayaran apa aja, buat jadi pelajaran aja gratis ongkir jangan pilih pilih yaa min",positif
farinasila,Pelit koin dan udh gak dpet gratis ongkir lagii.. gratis ongkir cuma untuk shopee pay doank. Huft! Makin lama makin males belanja dshopee mnding di aplikasi blnja lain aja ada gratis ongkirnya.??,positif
whyzihan,Udh download terus aku unistal lagi Terus download lagi malah lama amat ya??,positif
wandashrtni,"Skarenag ga da bebas ongkir, jangan d download.",positif
leetaisho,"Saya memperingatkan pada shopee Jangann keluar di google ganggu ajaaa mau download lagu parah aplikasi shopeeee keluar jadinya g bisa download lagu saya peringatkan untukkk tidakk keluarrr di googel,chrome,danbrowserr.Kalo di iklan gamee youtube g masalahhh!!!!!!!!!!",positif
ranidwilestari99,"Saya pengguna shopee,,,sangat kecewa karena uang shopepay saya hilang 3,1 juta,,,dan shopee tidak bisa membantu,,dn tidak bertanggung,,ngapin adain shopepay malah jadi uang saya hilang,,,akun malah dibobol tim shopee,,,tiba""bnyk sms dari shopee,,, Shopee sudh tidak amann,,,buat data2pribadi,,, Dimna rasa kepeduliannya,,, Semoga semua ada balasannya,,,sudh saya ikhlaas kn walapun uang arisan orang2,, Saya kasih bintang 1 jha,,,",positif
rahajengayuuu,Kok shope ini lambat ya Gw pikir shope ini cepat? Ehh ternyata Lambatnya minta ampunn,positif
karinamutiara,Niatnya mau instal tapi pelanggan dan pemakainya bnyk yang ngeluh jadi gak jadi untuk instal nih aplikasi,positif
nadia_24,"Penjualnya banyak yang gak amanah, tolong ditingkatkan lagi kwalitas dan penjual2 nakal tolong ditindak.",positif
merii05,Mana gratis ongkir yang dulu?,positif
Viviwyn,Shopee kurang belajar masa alat dj aku belum datang sampai sekarang yasar kali padahal aku pesan ya dari tanggal 8 sampa 21 ga datang datang peyu,positif
rrdinar,Gak bisa klaim voucher? Gini katanya mempermudah?. OI BANGON sudah DHUHUR,positif
alvinawlsch,Sumpah ya kenapa shopee sekarang jadi gini Tengah2 di pakai harus log in lagi log in lagi Capek tau Lama2 aku uninstal juga nich,positif
widiaastuti14_,Kebanyakan iklan,positif
Momono,"KESELLLL banget SM aplikasi SHOPEE !!!! ?????? skarenag Loading lama bangett TAPI SINYAL LANCAR DIpakai YTB JG GA LOADING lahh ini loading sekitar 20 detik baru muncul terus kalau lagi nyari barang terus""an bakal gak muncul alhasil harus keluar aplikasi shopee dl baru bisa",positif
felfell,"untuk shoppe.mohon kedepannya kasih fitur untuk bisa menghubungi pihak pengirim (JnT/JnE). karena saya sudah melakukan pembellian dan pembayaran, pakait saya malah diterima orang lain. kenapa pihak pengirim tidak menghubungi pembeli terlebih dahulu. padahal saya sudah menulis nomer saya dengan sangat jelas. saya kecewa sekali, uang saya terbuang sia""",positif
Rahma16_,Tidak memuaskan,positif
anyameraldin,"admin ini kok dari tdi gak ke instal yah dari tdi kaya ke stak gitu terus juga gak jln jln loh % nya, tolong yah di prebaikin",positif
danisawulan,"Makin ribet , makin ga nyaman.. transaksi mudah cuma untuk pengguna shopeepay doang .. ribet juga kalau mesti isi saldo",positif
hanalike,Pliss jangan lemot,positif
fournnes,"Pengirimannya pilih yang shopee express sameday tapi udh 3 hari gak sampe"", disebelah yang reguler aj bisa 1-2 hari sampe",positif
sherryls,"Hay shopee.makin berat aja sih ini. Makin di update makin lemod. Saya minta tolong. Tolong banget. Hapus aja deh itu game2 atau update yang enggak perlu. Kami butuh belanja dengan nyaman, cepat dan ga berat buat buka aplikasi nya. Atau cobalah bikin shopee lite yang ringan kalau emang sayang sama game mu daripada kenyamanan belanja. Ini di hp saya app shopee paling ngabis2in memori. Buset dah. Ini sama marketapilace FB lite aja kalah ringan jauh banget. Lemot jadi males update2.",positif
meutyazahra,"Kenapa shopee gk bisa diperbaruhi terus gk bisa buka shopee,untuk mencari ap yang kita mau",positif
novaazr,.r juga itulah mengapa hsgi,positif
hannyyosephine,"akun saya dibekukan padahal saya tidak melakukan kesalahan. padahal baru saja diperbaiki. apanya yang diperbaiki kalau dibekukan lagi? saya sudah top up shopeepay, tapi akun dibekukan. mau dikemanakan uang saya? apa ini caranya shopee mengambil uang konsumen? sungguh tidak bertannggung jawab!!! saya sudah lama memakai shopee dan melakukan transaksi berulang kali tapi kenapa dibekukan? aplikasi tidak bertanggung jawab!!!!!!!!!!!!!!!!!!!!!!!!",positif
Viraauliaaliy,Kenapa ya shopee makin susah dibuka?,positif
erf1994,Masalah mulu...mau live ada aja gangguannya,positif
sitinatasya,"Kenapa shoppepay later saya dikunci padahal sudah update info, padahal gk pernah telat bayar, sudah ub cs kata ya ada ketentuan yang ngak sesuai, tapi ngk disebut apa, buka donk blokir shoppelater saya",positif
milaku,Parah bnget ga bisa kebuka semua fto2 dagangan nya jadi lemot kalau bisa perbaiki aplikasi nya jangan kaya gini,positif
nshellv,Kenapa COD tidak pernah barang diantarkan. Apalagi kalau kurirnya JNT. shopee harus tegas terhadap ini. Kalau tidak sanggup pihak KURIR JNT Mengantarkan pakait COD. lebih baik tidak usah dibuat COD atau kerjasama dengan pihak kurir tersebut. Hanya membuat kecewa pelanggan saja.,positif
fasskinjournal_,"Mahal sekali barang""nya",positif
najwashivva,Katanya Gratis ongkir huh ternyata nggak,positif
aristyadini,"sudah lunas beberapa bulan lalu, saldo spaylater saya masih belum dikembaliin parah si emang",positif
yayaa88,mengapa saya tidak dapat menggunakan voucher gratis ongkir sekaligus dengan cashback? setiap ingin menggunakan gratis ongkir sekaligus cashback yang terpilih hanya salah tau doang tidak bisa di klik bersamaan.,positif
Nawalrina,Ka aku udh 2x nge instal ini kenapaa aplikasi nya ga muncul d hp sayah padahal sayah brulang kali nge instal ke aplikasi baru,positif
Tasyardelia291,Katanya potongan 50rb kalau belanja 300rb nyatanya potongn cuman 20rb ????????????????????????????,positif
Ndi,Vouchernya sering ngak bisa dipakai dan banyak iklanya yang menganggu,positif
asihbudi,Dah lah males ??,positif
Dhea1008,Pengirimannya mahal sekarang gak kayak dulu percuma vouchernya gak bisa membantu..,positif
Najwashivaa,maaf dari ????? jadi ?Sekarang kok gini y ongkir pilih belakangan ubah ongkir. . sudah cek out bayar baru ketauan bisa rubah ongkir. Dimana2 y milih ongkir dulu laahh.. anehh. Yang tau exp mana yang baik dan cepatt itu y cuma pelanggan. Jadi biarkan sya memilih sendiri exp apa..,positif
erma,ternyata aplikasi segede shopee pun masih problem untuk masukin akun .. gimana mau belanja .. percuma iklan di mana² tapi problem banyak .. mending kurangi budget iklan untuk perbaiki aplikasi nyaa..??,positif
justi,"Ribet2 mau ganti nomer aja harus ribet,apa saya sekolah hacker biar gampang ganti nomer akun shopee",positif
febbyindraa,Kmrn seneng liat aplikasi ini sekarang sudah di update malah tambah gak keluar gambarnya jadi gk semangat,positif
Grifithts,Mau ganti username harus hapus akun terus verifikasi ktapi harus beda orang ribet amat,positif
ebbysilvia,Lama bangat ngunduh aplikasi ini,positif
peachyluvv,"Lu itu cuman aplikasi belanja   ,msak kudu btuh sinyal kuat buat lancar loading ny Dkit2 psti update",positif
Rizwana,"Shoppe 12,12 tapi sekarang sudah tgl 19 pesanan blm sampe (pke kurir j&t expres,parah banget pengiriman belanja di shoppe,pesanan lama dipegang kurir gk sampe2",positif
DewiSetyaR,Jelek'banget asli aplikasi nya,positif
Mairifannisa,"Saya kasih bintang 1 karena shopee pay later saya belum muncul muncul,temen saya baru daftar langsung muncul shopee pay later nya,payahh",positif
Lelaindah22,"Kecewa !!! Capek"" ngumpulin poin, Game Shopee mancing nya hilang !!!",positif
puspawidhi_,Saya beli baju ditipu terus ????????shope kan banyak penipu,positif
anndisya,Nganter nya lama cuman beli sepatu doang 7 hari baru sampai,positif
hannaaudita,"Shopee pay later saya limitnya jadi 0,padahal bayar gak pernah telat bayar:( Kecewaaa banget:(",negatif
vezahanana,"kenapaa ko sekarang pilih pengirimny ng banyak, j&t expres atau yang lainy ko nga add",negatif
vanittalatte,Enakan yang sebelumnya saat tidak ada opsi pengiriman hemat reguler dll..ribet mahallllllll...sy sudah nyaman dengan yang lamaaaa...pindah toko ajalahhhh ...,negatif
choica,"Bintang 1 lebih co2k, setelah di Update malah di ubah gak bisa milih kurir/jasa pengiriman,tidak perlu gratis ongkir yang penting bisa pilih kurir.",negatif
hildajasmine,"bintang lima untuk tahun"" kemaren",negatif
dellaaaax0,Jasa kirim dikekang.... ??????,negatif
Hanifatussyahadati,"Hallo min, saya sudah info ke IG @shopee_id, tapi kenapa belum ada jawaban sampai sekarang? Padahal dari hari minggu. Tolong lebih care lagi min sama customernya. Ditunggu",negatif
rifaazalfaa,"Kak kenapa daftarnya susah ya sekarang ,",negatif
Davico26,"Padahal dulu waktu baru baru makai aplikasi shopee pengemasan dan pengiriman nya cepet. tapi sekarang pengemasan dan pengiriman nya lama banget, voucher juga sudah jarang ada, banyak buat pengguna shopeepay aja",negatif
skinbingbing,Orang2 heboh dapat kenaikan limit...lah gw limit malah NOL dari semenjak Corona... WHY??? padahal gk prnh telat bayar.... Jiiirrr,negatif
karensilvia,Auto Delete kalo Secret number kalah Vote. Dalam 1 menit +30 RB voted untuk SK . Maklum sih masih jadi Brand ambasador nya. Wkwkwk LOL (the power of orang dalam). Mending pakai market place lain aja LOL,negatif
aika_by,"Tadi nya saya sudah kasi bintang 5 , jadi begini saya beli barang . Posisi saya lagi kerja Terus. Disitu stattus sudah di terima atas nama saya . Tolong dong kasi tau kurir nya kalau misalkan di titipin ke kluarga , di terima nya atas nama keluarga . kalau oleh tetangga di sebuntukan nama nya . Ini skarenag barang saya belum sampai tapi stattus nya sudah di terima !! Parah",negatif
jihanhanaaa,"Ampas banget,isi saldo shopeepay pay ga tau kapan masuknya,keburu barang pesenan abis....su asu",negatif
penggunabaru,"Makin kesini ongkirnya makin mahal, harga barang sama ongkirnya malah mahal ongkirnya&sudah gak ada voucher gratis ongkir lagi",negatif
macaround,"Kaga bagus shopee,masa akun w di bekuin ga bisa belanja lagi.parah",negatif
venitawidya,"Saya benar2 kecewa dengan aplikasi shopee ini karena pihak tim shopee sangat lambat dalam menyelesaikan kendala konsumen setiap kali konsumen komplen tidak ditanggapi dengan baik, dan suka PHP pihak konsumen, dan ketika konsumen masih menjawab chat tentang komplen tersebut malah tiba2 chat dihentikan tanpa memberitahu terlebih dahulu, dimana etika kalaian sebagai pihak tim shopee? ????????????",negatif
fandanofita,Saya paham situasi lagi begini tapi tolong lah jasa pengirim jangan kaya asu ! Saya juga mencari nafkah Biayanya itu loh sampe melebihi barang yang mau kita beli ..sudah mengalami keterlambatan 1-2 hari.. Jadi tolong lah saya juga reseller,negatif
vianivia10,APAAN SI INI BARU DOWNLOAD AJA NGESTUCK DI 78% GAJELAS!! sudah 2 KALI DOWNLOAD SAMA AJA,negatif
Callme_ressy,"Setiap buka aplikasi, belum pun muncul gambar tiba2 aplikasi shopee ku tertutup sendiri.. padahal aku mau belanja :'(",negatif
dianntys,Iklan kepanjangan di aplikasi lain,negatif
mikalopita,Jelek banget ini aplikasi mau main aja gak bisa,negatif
ratmadn,di permainan candy crusah shopee . sy sudah di level 111. tapi gmn mau cr main nya. di kunci semua . tolong d perbaiki.,negatif
anyewlir,"Kecewa sama shopee jelas"" punya gratis ongkir tapi ketika dipakai tetap masih ada ongkirnya, jelas"" tertulis diaplikasi untuk pengguna baru bisa klaim hadiah gratis tapi ketika mau klaim gabisa dengan alasan jaringan eror padaha l buat cekout barang lain bisa aja!",negatif
anastasianovita88,Maap ya pe shopee. Kenapa sekarang jadi gini sih. Masak kita gak bisa pilih ekspedisi asli jadi kesel banget ongkir jadi mahal ya untung kalo ketemunya jnt ekspress kalau dikirim pakaik sicepat jadinya lemot banget ya gini kalo gak bisa milih sendiri jadi males ordernya,negatif
melisa13,KURIR SHOPEEE KELAMAAN KALAU NGIIRIM LEBH BAIK ESKPEDISI YANG LAIN,negatif
rosaliaharjasumantri,Barang katanya free ongkir padahal udh pakai voucher.pas di checout memang Free .eh giliran checout ke 2 mlh trnyata ongkir .ongkirnya mahal pula udh terlanjur ngumpulin barang mau dipesen ternyata ongkir.kecewa banget.,negatif
salmaulid17,"Akun jelek,, Vocher pengguna baru tidak bisa digunakan",negatif
silminrzh,"Voucher gratis ongkir gak bisa digunakan harus update dlu,udh d update masih gaada dan gabisa. Boro2 mau klaim, voucher nya aja gak ada. Iklan nya selalu gratis ongkir nyatanya harus beli dulu voucher nya dan cuma pakai Shopee pay yang bisa. Mana memory gede banget sedih akutu",negatif
Lisaa1305,"Shopee tanamnya tidak berfungsi, tidak bisa dimainkan. Malahan hp saya jadi lag.",negatif
kaifaasyila,"Masak cuma saya yang g bisa cod. Biasa nya bisa cod kok tau2 g bisa. Aneh, yang undian berhadiah nya juga kelihatan tipuan. Parah",negatif
oliviadlya,Hih komunitas shopee nya gak sabaraan,negatif
tsabithaadc,Ongkir gratis ga jelas. Terus masa ongkir gratis saya harus nombok 58rb sudah cancel aja penjualan saya drpd nombok,negatif
oliviaoen,"Akhir"" ini shopee menyebalkan padahal sudah di update ke versi terbaru ttep ajah lola banget gk muncul gambarnya. Kan jadi kesel ka. Padahal pengen order. Tolong dipebaiki lagi kak. Nnti aku kasih bintang 5.",negatif
annoctv,Untuk sementara sy ksih Bintang 1 dlu yaa. Lihat kedepan amanah atau tidak. Soal bintang mah gampang. Lihat kinerja selanjutnya kedepan,negatif
karenpadma,"Aplikasi suka ngelag, gambar/ photo ngga keluar padahal FB,browser lancar. Sayang sekali padahal seneng belanja sini karena promo ongkir.lama lama gondok juga kalau gini.",negatif
imqueenan,Mau batal pesanan tidak bisa,negatif
fryndee,"knapa sih sekarang shopee jadi berubah, udh cinta banget padahal huhu ???? cod harus 50k voucher gratis ongkir juga dipersulit banget ??????",negatif
rafikaamaliaf,"Sehabia update jadi susah login . Makin ribet nih aplikasi. Bukanya makin maju, login via fb , biasanya langsung masuk. Tapi skarenag minta kode verifikasi, udh di tunggu ga muncul verifikasinyaa",negatif
krisniaaluna,"Hati hati banyak penjual yang menyeetakan nomor resi palsu, jadi hanya muncul nomor pelacakan tetapi barang blm dikirim ataupun dikemas sama sekali. Dan dari pihak shopee memfasilitasi hal tersebut dengan tidak menyertakan fitur batal beli.",negatif
ggriselda,"Aplk tolol,, setiap mau belanja harus log-in dulu,,padahal sudah log-in dari awal install",negatif
yolanda_gunawan,"Dulu shope sangat bagus. sekarang malah mengecewakan. Balikin sistem yang kyak dulu. biar pembeli bisa ngegunain jasa JNT atau JNE lagi. Untuk sekarang ku kasih bintang satu dulu yak, kalu sudah balik lagi sistemnya. Akan ku ubah lagi kembali menjadi bintang 5.",negatif
suryaningts,"Parah saya ditipu sama TOKO di shope,, pas saya beli voucher pertama dikirim sesuai bukti,, pas saya beli voucher kedua di penjual kirim bukti saat transaksi pertama,, saya ajukan pengembalian tapi pihak shope mengatakan dimenangkan oleh penjual, karena penjual ada bukti transaksi pertama saya kecewa!",negatif
ratna_pertiwi28,"Kecewa sama Shopee kecewanya karena enggak bisa milih opsi pengiriman,. ?????? Lama-lama banyak yang akan meninggalkan aplikasi Shopee",negatif
diararum,"Gini ya kalo misal pengiriman nya dipilihin sama shopee terus pas kena j&t atau si cepat alamat pakait saya hilang karena jnt tidak mau antar kerumah saya sedangkan si cepat itu kalo nganter lama, kalo kya gini deh auto uinstal shopee atau beli produk luar yang jelas dianter pakai jne, maaf saya tarik lagi 4 bintang nya, gk ngerti ini dapat ide dari mana ngerubah pengirim kya gini selamat tinggal shopee, bakalan belanja lagi kalo sudah di perbaiki kesalahannya",negatif
nailaslsbila,Shopee    masa ngk bisa daftar padahal udh bener semua macam  lah.,negatif
tisa_prihatini,SHOPEE ARISAN SAYA TIDAK BISA DIBUKA. STUCK DI LAYAR PUTIH,negatif
shabieela,"Shopee tolong respon. sudah 3 hari dana saya belum dikembalikan, nunggu dari pihak shopee juga belum diproses. Tolong pihak shopee ditingkatkan lagi kualitasnya. INI GIMANA WOYY, UANG GUA   GA BALIK BALIK",negatif
HanikMaria2323,Jelek jangan download,negatif
Annisamfm,sangat buruk barang saya tidak sampai² seharusnya sblm tgl 18 januari sudah sampai tapi gak sampai² hri ini sudah tgl 23 januari.,negatif
octaofficial,Pengembalian dana katanya maksimal 1×24 jam ternyata bohong ! sudah hampir 3 hari dana nggak di kirim-kirim !,negatif
Aariyani,dapat kupon tapi gak bisa di klaim,negatif
adinsif,"Ini gimana sih shopee?? Koinku kok ilang Terus ,brusan dapat 10k koin ilang lagi ?? Gapaham deh ! Keselll",negatif
anidiahparamesti,"Maaf ya jadi bintang 1, pengiriman jadi lelet",negatif
sitikomariyatun,"Pakai shopee express surabaya mojokerto sampainya 4hari sedangkan kalau pakai j&t semalam aja sudah sampai, barang nggak sampai tepat waktu jadi customerku pada kecewa. Ini bukan layanan yang saya inginkan ya",negatif
Saniahasna,"Shopee sudah gak asikk lagi, terkait jasa pengiriman sudah gak bisa memilih. Pihak shopee yang tentukan. Dan waktu pengiriman sangat lama.solusinya pindah ke aplikasi yang lain...",negatif
mutiarahai03,"Kok setiap mau bayar ga bisa ya, sudah update sama install ulang juga padahal",negatif
aysahkarlina,Kok mau verivikasi no hp gk bisa2,negatif
ipichi,aplikasi nya jlek nggak kaya dulu bagus,negatif
deviminerva,"Ini gmn si ka saya download dari tadi ko ga kepasang²ya udh berulang²kali,tlng dong konfirmasi nya!",negatif
leegummy,"Aplikasi kopet... Masak dipakai beli pulsa g bisa, muncul tulisan anda telah memenuhi kuota pembelian har ini...?????????????????????????????????????????????????????????????????????? Mau ditransfer ke Bank ribet ny... proses verifikasi lelet... Ribet dah pakai shopee ...????????????",negatif
candraayudewi,"makin hari shopee ga jelas,mana pelit gratis ongkir lagi,kek nya pindah lapak aja lagi",negatif
Novrida,"Saya melakukan pengisian pulsa dengan metode pembayaran transfer melalui bank, status di mbanking saya udh berhasil tapi status di shopee masih belum bayar juga !! Saldo sengaja saya sisain bwt isi pulsa tapi malah kesedot ga guna !!",negatif
LdC,Makin berat aja ya,negatif
efarmi16,"performa shopee sekarang menurun, lelet, padahal jaringan saya bagus tapi buat check out aja susah. tolong dimaksimalkan lagi",negatif
herlibq,Harusnya Sama seperti sebelum-sebelum kita sebagai pembeli bisa memilih ekspedisi sesuai keinginan kami.... Kl spt ini kita g bisa nentuin paki ekspedisi apa!!! Dan lagi kita g bs nikmatin free ongkirnya!!!! Payah ???????????? kebijakan yang sungguh tidak mengenakkan di kami para pembeli,negatif
oliverellua,Kenapa sekarang ga bisa top up free fire padahal sekarang banyak event seru pas mau top up lah ko ilang voucher games nya terus saya harus top up dimana?coba adain lagi dong,negatif
mentarigazali,Shopee tanam.. Penipu Ujung2 nya sruh beli dan bayar juga!!! sudah tanam lama2 Ujung2 nya Duit dan bayar.. Mending Langsung beli aja ngapain lama2 tanam. Asu lah,negatif
eorendil,"Ah,Kenapa ini Shopee lama amat buat nunggu Kabar antar Kirim Pesanan kok malah bertele2 updatetan ya,belum lama saya pakai,Aplikasi kok kayaK Abal2 dikit2 Upgrade tan apa sih yang mau diupgrade, apa ada lagi tentang Virus atau masalah Tanggulasi Pandemi Budidaya Tunggu Bilang Operasional Corona Ya Shopee.",negatif
syafira_pk21,"Game shopee mancing gak jelas, masa poinnya bukannya nambah malah kurang banyak, emang bener sih mancing (mancing kemarahan)",negatif
intanrahmania882,"Tolong untuk jasa layanan pengiriman AntarAja dibuang, karena barang sama sekali tidak bergerak sampai berhari-hari, saya sebagai customer merasa di rugikan dengan waktu dan finansial, karena barang harus di ambil di tempat. semoga pihak shopee memperhatikan dalam bekerja sama dengan jasa pengiriman barang.",negatif
tifaasgaf,"aplikasinya lemot banget. Gabisa login padahal sudah coba pakai line, pakai password cuma loading, pakai nomer telpon kodenya gamasuk, maunya apa sih Tambahan: tiap kali mau ngasih ulasan selalu aja tulisannya halaman sedang dalam perbaikan. Capek tau nulis ulasan, masak mau ulang lagi",negatif
atikasanjanir,Iklan nya mengangu aku waktu main game!!!!,negatif
bethsandi,Kok ngga bisa metode COD? tulisannya bisa padahal,negatif
ayleena,Aplikasi shopee penipu saldo shopee pay saya d bobol sama penjuallb,negatif
tiarasetianto98,"Kurirnya gak bisa milih, biasanya saya make kurir j&t sekarang jadi gak bisa milih kurirnya, kecewa bangey shopee standar expres lama sampainya biasanya sehari sampe skrang 3 harian baru sampe kecewa lah",negatif
jesslynlavender,"Ribet banget sekarang, sangat kecewa!!!",negatif
gweeen,"Semakin ke sini shopee semakin membagongkan. Jasa kirim hilang, gratis ongkir hanya untuk shopee pay. MAU MARAH!!!! TAPI SUARA PELANGGAN KECIL SEPERTI SAYA INI BISA APA!! SEMAKIN MEMPERSULIT.",negatif
bellaputri853,"Ya Allah ngga ngerti Kemarin saya zakat via shopee dg pertimbangan himbauan pemerintah mengurangi interaksi Saya pilih shopee karena sepertinya jelas ada pakait untuk 4 orang, beserta nama masing2 Cukup meyakinkan ya? Lalu saya bayar via transfer dan berhasil 1 minggu kemudian di hari ke 2 lebaran saya chek akun kok ada dana nambah di shopee payku senilai zakat itu Ku telusuri ternyata dana zakatku dikembalikan ke situ Lemes dong artinya ramadhan ini kami sekeluarga ngga zakat",negatif
dewidyaaaaa,"Barang sudah diterima,tapi aplikasinya menunjukan barang sedang dikirim???????????????gimna coba bikin pusing aja.Ribet banget kya nya . Tolong diperbaiki lagii kedepanya??????",negatif
betterfliy,kodenya gak dikirim2 ngebug terus????,negatif
fanyekaff,Voucher gratis ongkirnya gak bisa kepakai,negatif
wigrahadeliaa,"kenapaaa jasa kirimnya sekarang gaada jnt dkk woiii sedih gabisa diatur sendiri,pliss shopee balikin kayak dulu lagi ya??????????????????",negatif
tifanizafhh,"Kenapasiii sekarang jasa kirimnya ga bisa pilih sendiriiii, maaf yah kasih bintang satu. Dan tolong ubah jadi semula",negatif
Naedals04,"Shopee express standard= pengiriman lama, nggak update2",negatif
Priscilliachend,Setelah di update makin gk jelas di jasa pengiriman tolong di perhatikan lagi... karena pembeli cari yang terbaik untuk jasa pengiriman... @shopecare tlong dong di menu pengiriman di ubah seperti semula jadi bisa pilih ekspedisi yang di mau karena masing2 ekspedisi setiap daerh ada plus minusnya Klau seperti sekarang jadinya rondom jadi gk tau ekspedisi nya pakai apa Klau pas yang cocok di daerah tertentu yaa bagus klau tidak malah makin lama,negatif
zamitathy,Buruk. Setelah diupdate malah ngga bisa login. Jasa kirim otomatis dipilihkan shopee. Tidak fair. Giliran pembeli mau ubah opsi jasa kirim eh sudah keduluan seller acc jasa kirim. Ongkir id express yang tadinya cuman 7500 semenjak ada kebijakan shopee yang baru jadi 12.000. Korupsi.,negatif
Nainawa,"Setelah diapdute ko malah gak bisa lihat etalase toko nya ya,malah informasi gangguan suruh muat ulang aja. Jadi gak bisa liat² barang²nya.",negatif
fauzizahfaqih,Akun saya tiba tiba di bekukan . Padahal saya ga melanggar . Tadi aja ada yang telpon mengatas namakan shoppe dan saya dapat hadiah . Dan dia juga tau nama saya sama alamat lengkap sama nomor saya . karena saya tidak percaya tiba tiba akun saya di bekukan . Apa akun saya ada yang nge hack,negatif
14x32,Tolong mengunduhnyah jangan lama banget,negatif
meviarahma,Aplikasi bodoh....gw waktu 12.12 begadang buat dapatin diskon tapi alamat gk tertera di shopee udh seneng diskon tapi bege banget,negatif
Arshafarie,Apaan sih gratis ongkirnya gak bisa di pakai... Tipu-tipu.. Pas mau di check out gagal gagal... Hadeh kalo memang gak niat ngasih gratis ongkir yowes gak usa,negatif
slsabilasofii,"Sangat kecewa dengan respon CS, mohon diberikan coaching dan refreshment kembali seperti nama CS anonim Rinto, Gagat, Atira sangat-sangat kecewa..",negatif
fuzifau,Download loading sumpah??,negatif
sasaalma_,Semenjak Shopee tanam bisa nyuri air.. Saya jadi g suka Shopee.. Saya yang biasanya panen koin 2 hari jadi 5 hari gara2 dimaling terus... Inimah ngajarin anak orang buat jadi pencuri... Udh mah yang nyuri g nyiram kebun saya... Masih mending kalau nyuri tapi disiram kebun saya... Untuk Shopee tolong hps lagi fasilitas buat nyuri air !!! Saya bakal kasih bintang 5 kalau fasilitas buat nyuri air di hapus!!! Sama sekarang jarang banget voucher gratis ongkir tapi buat tunai...shopee jangan pelit donk!!!,negatif
mza92,Shopee mau memonopoli jasa kirim,negatif
